{"adjudicationId":"autograd-context-ch33-ch37.en.r12-r6.20260918.isolated-surface.adjudication","adjudicator":{"accessBoundary":{"declaredArtifactIdsRead":["context-manifest","prompt","adjudication-bundle","adjudication-record-schema"],"mode":"declared-read-only"},"completedAt":"2026-09-18T07:37:01Z","contextId":"collab:root:en-isolated-adjudication-20260918","freshContext":true,"model":"gpt-5.6-sol","reasoning":"ultra","startedAt":"2026-09-18T07:36:57Z"},"candidateId":"autograd-context-ch33-ch37.en.r12-r6.20260918","findings":[],"reviewFindingAdjudications":[],"role":"isolated-surface","schemaVersion":1,"scopeId":"autograd-context-ch33-ch37.en.20260918","surfaceAdjudications":[{"findingIds":[],"judgment":"supported","rationale":"The review applies the frozen standalone-card requirement completely: it identifies the purpose label's explicit non-ambient recording choice and grounds the immutable context value, recording constructor, no-gradient constructor, and reporting method in the displayed excerpt. Its pass assessment is sound.","reviewAssessmentJudgment":"pass","surfaceId":"isolated.ch33.context-card"},{"findingIds":[],"judgment":"supported","rationale":"The review checks every required operation in the standalone card and preserves their order and relationship: the forward result is checked first, result tracking combines explicit context policy with parent tracking, and disabled recording clears parent edges. Its pass assessment is sound.","reviewAssessmentJudgment":"pass","surfaceId":"isolated.ch33.policy-card"}],"verdict":"pass"}
